"selection1_name","selection1_selection2"
"Brilliant Brain Activity Book 6+","4.4 out of 5 stars"
"Encyclopedia: The Solar System and its Dwarf Planet (Space Encyclopedia)","4.4 out of 5 stars"
"Score More Case Study Chapterwise Practice Questions Science Mathematics English and Social Science Class 10","4.4 out of 5 stars"
"Manohar Parrikar: Brilliant Mind, Simple Life","4.5 out of 5 stars"
"The Graveyard Book","4.6 out of 5 stars"
"The Third Angle","3.9 out of 5 stars"
"The Illustrated Stories Of Tenali Raman: Classic Tales From India","4.5 out of 5 stars"
"Pendrive Classes CA Intermediate (New Syllabus) Gr. II Paper-5 Advanced Accounting (Complete Studymaterial + Video Lecture + Testseries) (May 2020)",""
"THE SECRETS","5.0 out of 5 stars"
"A Book For TGT English Literature SUCCESS IN YOUR HANDS...Your selection is our mission. Volume-2 ENGLISH LITERATURE","5.0 out of 5 stars"
"All set to Read- A Phonic Reader- Bob and the Funny Log- Readers for kids","4.5 out of 5 stars"
"Great Stories for Children","4.5 out of 5 stars"
"Gist Of NCERT - 17 Books In 1 - Class 6-12","5.0 out of 5 stars"
"Jolly Kids My First Book of Phonics Words Key to Letter Sound Relationship| Learning the Letter Sounds| Blending| Word Formatting| Sight Words| Phonic Activity Book for Kindergarten Ages 3-7 Years","4.6 out of 5 stars"
"GIKSO 100 Maths Puzzles Book - Brain Boosting Mathematical Activities for Age 7+ Years Old Kids | Game Book (English) - Reprinted 2020","4.3 out of 5 stars"
"Class 4 Books Set (Rimjhim, Marigold, Maths Magic, Looking Around) SchoolWaale Binded","3.0 out of 5 stars"
"101 Panchatantra ki Kahaniyan for Children: Colourful Illustrated Stories","4.6 out of 5 stars"
"25 Greatest Speeches Of Vivekananda",""
"TARGET MHT-CET Online Engineering Test 2021 - Past (2020 - 2016) + 10 Mock Tests (7 in Book + 3 Online) 3rd Edition","3.4 out of 5 stars"
"Centaurs of Kabecka : Mahika : Bhama Duology : Book 1: Mahika: Bhama Duology: Book 1","5.0 out of 5 stars"
"NTA UGC NET/SET/JRF: Paper II - English | First Edition| By Pearson","4.2 out of 5 stars"
"Julia Donaldson X10 Books Pack (with Carry bag)","4.8 out of 5 stars"
"DRISHTI NCERT SERIES 4 Books Combo","4.4 out of 5 stars"
"Capital Letters ABC: Write and practice Capital Letters A to Z book for kids (Writing Fun)","4.3 out of 5 stars"
"World’s Best Inspirational Books to Change Your Life (Box Set of 3 Books)","4.3 out of 5 stars"
"Std-1 / Class-1 ACE 6 Books 432 Pages All-in-One Early Learning Worksheets English, Mathematics, EVS & Fusion Activities by Mixing Multiple Subjects with Free Word-Power Intelligame from 3H Learning","4.7 out of 5 stars"
"Develop Reading and Writing Skills of Kids, Longman Reading Comprehension and Composition Book, 6 - 7 Years (Class 1), By Pearson","4.4 out of 5 stars"
"Lines and Curves (Pattern Writing) - Part 1","4.4 out of 5 stars"
"My Fun Learning Kids Library (10 Board Books) - Gift Box Set - Wall Mountable & Easily retractable","4.5 out of 5 stars"
"IMU CET Entrance Exam Books Full Package","4.1 out of 5 stars"
"Concise Oral Pathology","4.4 out of 5 stars"
"Julia Donaldson X10 Books Pack (with Carry bag)","4.8 out of 5 stars"
"DRISHTI NCERT SERIES 4 Books Combo","4.4 out of 5 stars"
"Capital Letters ABC: Write and practice Capital Letters A to Z book for kids (Writing Fun)","4.3 out of 5 stars"
"World’s Best Inspirational Books to Change Your Life (Box Set of 3 Books)","4.3 out of 5 stars"
"Hacking: 4 Books in one",""
"Std-1 / Class-1 ACE 6 Books 432 Pages All-in-One Early Learning Worksheets English, Mathematics, EVS & Fusion Activities by Mixing Multiple Subjects with Free Word-Power Intelligame from 3H Learning","4.7 out of 5 stars"
"Develop Reading and Writing Skills of Kids, Longman Reading Comprehension and Composition Book, 6 - 7 Years (Class 1), By Pearson","4.4 out of 5 stars"
"Beginners's Guide to Chalk Painting","4.1 out of 5 stars"
"How to Stop Worrying and Start Living: Time-Tested Methods for Conquering Worry","4.5 out of 5 stars"
"The Unspoken Words From Childhood to Adulthood",""
"The Last Queen","4.5 out of 5 stars"
"Jolly Phonics Teacher's Book: in Precursive Letters (British English edition)","4.4 out of 5 stars"
"Where Is Baby's Belly Button? (Karen Katz Lift-the-Flap Books)","4.6 out of 5 stars"
"The Intelligent Investor (Marathi)","4.3 out of 5 stars"
"Dinosaurs - Wow Encyclopedia in Augmented Reality- Age 6+","4.6 out of 5 stars"
"Nursery Rhymes (My Jumbo Books)","4.5 out of 5 stars"
"NCERT Class 3 Books Set 4 Books","3.8 out of 5 stars"
"International Mathematics Olympiad Work Book -Class 3","4.5 out of 5 stars"
"Amazon Brand - Solimo Baby Record Book","4.1 out of 5 stars"
"Tally .ERP 9 in Simple Steps","3.7 out of 5 stars"
"Antim Sankshep","4.7 out of 5 stars"
"Helpless: The true story of a neglected girl betrayed and exploited by the neighbour she trusted","4.5 out of 5 stars"
"What's Up With Me?: Puberty, Periods, Pimples, People, Problems and More","4.7 out of 5 stars"
"English The Parable of the Pipeline Set of 6 Books","2.7 out of 5 stars"
"LOKSEVA YEAR BOOK 2021","5.0 out of 5 stars"
"Shivangan JPSC Jharkhand lok seva ayog Pt exam Paper 1 and 2 30 model practice sets with with described answers-2 book","3.0 out of 5 stars"
"My Big Book Of Social Studies 5","4.1 out of 5 stars"
"International Mathematics Olympiad Work Book -Class 6","4.6 out of 5 stars"
"TOPIC WISE CIVIL &MECHANICAL QUESTIONS & ANSWERS: TRACER/ OVERSEER ( KWA/ IRRIGATION)",""
"The Last Queen","4.5 out of 5 stars"
"Guided Biology Practical Word - Book (CBSE - XI)",""
"Join Merchant Navy - Sponsorship Guide | Way2ship","4.4 out of 5 stars"
"English Olympiad Class 2nd","4.4 out of 5 stars"
"Oswaal UG CLAT Mock Test, 15 Sample Question Papers (For 2021 Exam) Book","4.5 out of 5 stars"
"Navneet Digest cum Practice Book (Paper 2) for 2021 Scholarship Examination - Standard V (Class 5) - Maharashtra Board English Medium","4.5 out of 5 stars"
"Chakshu UP Junior Super TET Aided High School Pradhanadhyapak Evam Sahayak Adhyapak (Assistant Teacher) Bharti Pariksha Paper-1 (Samanya Gyan) Complete Guide Book 2021","4.4 out of 5 stars"
"NCERT textbooks class 12th physics part 1&2 chemistry part 1&2 and mathematics combo 2019 set of 6 book","4.2 out of 5 stars"
"Zero to One: Notes on Start Ups, or How to Build the Future","4.4 out of 5 stars"
"Story Of The White Ghoost: A Bedtime Story Picture Book for Kids | English Fairy Tales","5.0 out of 5 stars"
"Current Affairs for 2021 Exams | January to December 2020 MCQ Hindi by Sarkari Job News","4.5 out of 5 stars"
"Currency Trading For Dummies (For Dummies (Business & Personal Finance))","4.5 out of 5 stars"
"Illustrated Text Book of Neuroanatomy","5.0 out of 5 stars"
"Cambridge Montessori Preschool Nursery Book Set ( 3- 4 Years)",""
"Yoga For Men: Build Strength, Improve Performance, Increase Flexibility","4.6 out of 5 stars"
"The Complete Novels of Sherlock Holmes","4.5 out of 5 stars"
"Bhartiya Itihas - Arya Competition Times","4.5 out of 5 stars"
"Oswaal UG CLAT Mock Test, 15 Sample Question Papers (For 2021 Exam) Book","4.5 out of 5 stars"
"505 Activities for Kids","4.5 out of 5 stars"
"Navneet Digest cum Practice Book (Paper 2) for 2021 Scholarship Examination - Standard V (Class 5) - Maharashtra Board English Medium","4.5 out of 5 stars"
"Chakshu UP Junior Super TET Aided High School Pradhanadhyapak Evam Sahayak Adhyapak (Assistant Teacher) Bharti Pariksha Paper-1 (Samanya Gyan) Complete Guide Book 2021","4.4 out of 5 stars"
"NCERT textbooks class 12th physics part 1&2 chemistry part 1&2 and mathematics combo 2019 set of 6 book","4.2 out of 5 stars"
"Ladybird Big Noisy Book: Farm Hullaballoo!","4.5 out of 5 stars"
"Guided Health & Physical Education Text Book ( CBSE-X)",""
"Mission NDA : Serve At Young Age","4.7 out of 5 stars"
"Stay in the Boat Devotional Book: 30 Days of Hope for Hard Times",""
"Apke Avchetan Man Ki Shakti (The Power of your Subconscious Mind in Hindi)","4.4 out of 5 stars"
"NCERT textbooks class 12th physics part 1&2 chemistry part 1&2 and biology combo 2019 edition (pack of 5 books)","4.3 out of 5 stars"
"My Activity- Dot to Dot Activity Book","4.5 out of 5 stars"
"The Earth Our Habitat - Textbook Social Science for Class - 6 - 656","4.4 out of 5 stars"
"General Practice a Practical Manual with CD 5Ed (PB 2019)","4.4 out of 5 stars"
"Dear Stranger, I Know How You Feel","4.5 out of 5 stars"
"World's Greatest Sports Stars: Biographies of Inspirational Personalities For Kids","4.4 out of 5 stars"
"Amazon Brand - Solimo First Padded Board Book Pack, Set of 10","4.0 out of 5 stars"
"Personality Development Handbook","5.0 out of 5 stars"
"How To Do The Work: Recognise Your Patterns, Heal from Your Past, and Create Your Self","4.7 out of 5 stars"
"Message Large Print, The (First Book Challenge)","4.8 out of 5 stars"
"MHT-CET Triumph Physics, Chemistry and Maths (PCM) MCQ Books Combo for 2021 Engineering and Pharmacy Entrance Exam | Based on relevant chapters of 11th and 12th Syllabus of Maharashtra Board | 3 Books","4.3 out of 5 stars"
"My First Numbers Sticker Book: Exciting Sticker Book With 100 Stickers","4.4 out of 5 stars"
"101 Copy Coloring: Fun Activity Book For Children","4.6 out of 5 stars"
"A Modern Approach to Verbal & Non-Verbal Reasoning (2 Colour Edition)","4.4 out of 5 stars"
"Just Add Magic: Mystery City",""
"S.K. Jha सामान्य विज्ञान","3.6 out of 5 stars"
"Babylon Ka Sabse Ameer Aadami (The Richest Man in Babylon in Hindi): Hindi Translation of International Bestseller","4.5 out of 5 stars"
"Su Doku Challenge book 1: 200 Su Doku puzzles (Collins Su Doku)","4.4 out of 5 stars"
"Maroon In A Sky Of Blue","4.5 out of 5 stars"
"The Book of Investing Wisdom",""
"The Official Guide to the GRE General Test","4.5 out of 5 stars"
"Amazon Brand - Solimo Blossom Jumbo Creative Colouring Book for Kids, Level 1","4.7 out of 5 stars"
"DNYANADEEP ACADEMY MPSC ALL IN ONE 20000 + PRASHNASANCH","4.2 out of 5 stars"
"How to Stop Worrying and Start Living: Time-Tested Methods for Conquering Worry","4.5 out of 5 stars"
"मेरी लेखनी कुछ सीधी खरी। : कविता संग्रह (Hindi Edition)","5.0 out of 5 stars"
"SSC MTS (Multi Tasking Non Technical) Practice Sets With Solved Papers Book For 2021 Exam","4.1 out of 5 stars"
"How to Read a Book","4.4 out of 5 stars"
"Guide for Hotel Management 2021","3.9 out of 5 stars"
"My First Complete Learning Library: Boxset of 20 Board Books Gift Set for Kids (Horizontal Design)","4.6 out of 5 stars"
"Amazon Brand - Solimo My First Colouring Box (Set of 10)","3.9 out of 5 stars"
"Essentials of Preclinical Conservative Dentistry 2/e","5.0 out of 5 stars"
"The Science of Mind Management","4.7 out of 5 stars"
"26 Years UPSC IAS/ IPS Prelims Topic-wise Solved Papers 1 & 2 (1995 - 2020) 11th Edition","4.5 out of 5 stars"
"Reader's Squad Activity Book","4.6 out of 5 stars"
"Mahatma Gandhi Autobiography: The Story Of My Experiments With Truth","4.5 out of 5 stars"
"My First Learning Activity Bag - Set of 10 Exciting Activity Books","4.1 out of 5 stars"
"Amazon Brand - Solimo Long Board Book, General Knowledge","4.1 out of 5 stars"
"Story Time Library Phonics Jake's Birthday",""