"selection1_name","selection1_selection2"
"1984 (Deluxe Hardbound Edition)","4.5 out of 5 stars"
"Buddha at Work: Finding Balance, Purpose and Happiness at Your Workplace","4.5 out of 5 stars"
"My First Library: Boxset of 10 Board Books for Kids","4.5 out of 5 stars"
"World’s Greatest Books For Personal Growth & Wealth (Set of 4 Books): Perfect Motivational Gift Set","4.5 out of 5 stars"
"Mandala Art: Colouring Books for Adults with Tear Out Sheets (Adult Colouring Book)","4.6 out of 5 stars"
"World's Greatest Leaders: Biographies of Inspirational Personalities For Kids","4.3 out of 5 stars"
"A Man Called Ove: The life-affirming bestseller that will brighten your day","4.6 out of 5 stars"
"Ikigai: The Japanese secret to a long and happy life","4.6 out of 5 stars"
"One Arranged Murder","4.3 out of 5 stars"
"The Archer","4.3 out of 5 stars"
"The Maharaja of Mastipur & The Palace of Pranks","5.0 out of 5 stars"
"Because Life is a Gift: Stories of Hope, Courage and Perseverance","4.4 out of 5 stars"
"Sapiens: A Brief History of Humankind","4.7 out of 5 stars"
"My First Mythology Tale (Illustrated) (Set of 5 Books) - Mahabharata, Krishna, Hanuman, Ganesha, Ramayana - Story Book for Kids","4.2 out of 5 stars"
"Death; An Inside Story: A book for all those who shall die","4.7 out of 5 stars"
"Grandma's Bag of Stories: Collection of 20+ Illustrated short stories, traditional Indian folk tales for all ages for children of all ages by Sudha Murty","4.6 out of 5 stars"
"A Gentleman in Moscow: The worldwide bestseller","4.5 out of 5 stars"
"Unfinished: A Memoir","4.4 out of 5 stars"
"The Richest Man in Babylon","4.4 out of 5 stars"
"As a Man Thinketh","4.4 out of 5 stars"
"Who Will Cry When You Die?","4.5 out of 5 stars"
"Maybe You Should Talk To Someone","4.6 out of 5 stars"
"The Girl on the Train: The multi-million-copy global phenomenon","4.1 out of 5 stars"
"International Mathematics (International Baccalaureate Program) for Grade 1 by Pearson","5.0 out of 5 stars"
"Think Like a Monk: The secret of how to harness the power of positivity and be happy now","4.7 out of 5 stars"
"The Intelligent Investor (English) Paperback – 2013","4.5 out of 5 stars"
"NCERT Books Set for Class 9 (English Medium) Set of 8 books Paperback 1 January 2020 Paperback – 1 January 2021",""
"The Psychology of Money","4.5 out of 5 stars"
"Life's Amazing Secrets: How to Find Balance and Purpose in Your Life","4.6 out of 5 stars"
"My First Book of Patterns Pencil Control: Patterns Practice book for kids (Pattern Writing)","4.5 out of 5 stars"
"Chikitsa Guide For General Medical Practitioners","4.0 out of 5 stars"
"PERFECTION BOOK - ENGLISH WITH NIMISHA BANSAL","5.0 out of 5 stars"
"Wildpaper - Mammas In The Wild Board Book | Hard Bound | For kids",""
"The Curse To Ashwathama","4.0 out of 5 stars"
"A Love Portrait for the Silent Duke: A Historical Regency Romance Book","5.0 out of 5 stars"
"Combo Pack: Lakhmir Singh Class 10 Science (Biology, Physics, Chemistry) with Free Virtual Reality Gear (2020-2021 Examination)","4.4 out of 5 stars"
"SSC Constable GD Exam Practice Sets Latest Book For 2021","4.4 out of 5 stars"
"Quantitative Aptitude for Competitive Examinations","4.4 out of 5 stars"
"Clara's Moving: The Adventure begins (Clara King Adventures Book 1)","5.0 out of 5 stars"
"Rough Book",""
"American Pie Presents: The Book of Love","4.7 out of 5 stars"
"Switch On - Switch Off Acting Method / स्विच ऑन - स्विच ऑफ एक्टिंग मैथॅड: Camera Acting ki Sabse Saral aur Prabhavi Takneek / कैमरा ऐक्टिंग की सबसे सरल और प्रभावी तकनीक","4.9 out of 5 stars"
"Kaplan and Sadock's Comprehensive Textbook of Psychiatry","4.3 out of 5 stars"
"Guidance and Counselling",""
"Grossman & Baim's Cardiac Catheterization, Angiography, and Intervention (Old Edition)","4.7 out of 5 stars"
"Scanner CMA Foundation (2016 Syllabus) Paper - 4 Fundamentals of Business Mathematics and Statistics (Regular Edition) (Applicable for June 2020 Attempt)","5.0 out of 5 stars"
"ETSSE-EMRS Teaching Staff Selection Exam For TGT: Teaching Aptitude & Pedagogy Common For All Subjects (Teacher Recruitment Exams)",""
"Garbh Sanskar - jevu vavishu aevu lanishu (Pregnancy vishe nu A to Z Guidance) (Gujarati): ગર્ભસંસ્કાર - જેવું વાવીશું એવું લણીશું (Gujarati Edition)","4.7 out of 5 stars"
"Eating in the Age of Dieting","4.6 out of 5 stars"
"The Theory of Everything: The Origin and Fate of the Universe","4.6 out of 5 stars"
"The Blue Umbrella","4.5 out of 5 stars"
"Jumanji","4.7 out of 5 stars"
"Rich Dad Poor Dad (Marathi)","4.5 out of 5 stars"
"Wren & Martin High School English Grammar and Composition Book (Regular Edition)","4.4 out of 5 stars"
"World's Greatest Library : A Collection Of 200 Inspiring Personalities (Box Set of 8 Biographies)","4.3 out of 5 stars"
"Timeless Interiors: India, Dubai, Singapore","4.0 out of 5 stars"
"Turn a Blind Eye (William Warwick Novels Book 3)","5.0 out of 5 stars"
"Inner Engineering: A Yogi’s Guide to Joy","4.6 out of 5 stars"
"All set to Read- A Phonic Reader- The Cat and The Rat- Readers for kids","4.5 out of 5 stars"
"101 Panchatantra Stories for Children: Colourful Illustrated Stories","4.5 out of 5 stars"
"Becoming: The Sunday Times Number One Bestseller","4.7 out of 5 stars"
"NCERT Books Set for Class 10 (English Medium)Set of 8 books Paperback January 2019","3.5 out of 5 stars"
"Very First Sight Words Sentences Level - 1","4.5 out of 5 stars"
"Class 3 Books Set - 4 Books (Rimjhim Marigold Looking Around Maths Magic)","4.5 out of 5 stars"
"THE CURIOUS CASE OF THE BOARDING SCHOOL","4.0 out of 5 stars"
"Quantum Marketing : Mastering the New Marketing Mindset for Tomorrow's Consumers","4.7 out of 5 stars"
"Pendrive Classes CA Intermediate (New Syllabus) Gr. I Paper-3 Cost and Management Accounting (Complete Studymaterial + Video Lecture + Testseries) (May 2020)",""
"Scanner CMA Foundation (2016 Syllabus) Paper - 4 Fundamentals of Business Mathematics and Statistics (Fast Track Edition) (Applicable for June 2020 Attempt)",""
"How To Draw Cute girls: The Step By Step Guide To Drawing 12 Cute Girls Easily (BOOK 1).",""
"ट्वेल्थ फेल | Twelfth Fail | 12th Fail","4.7 out of 5 stars"
"Baavare Prem He",""
"equALLY: Stories by Friends of the Queer World",""
"Ayurvediya Garbh Sanskar (Marathi)","4.5 out of 5 stars"
"NCERT HISTORY,GEOGRAPHY,ECONOMICS,CIVICS BOOKS FOR CLASS 10","4.4 out of 5 stars"
"How to Prepare for Logical Reasoning for CAT","4.5 out of 5 stars"
"CSIR NET/JRF Life Sciences MCQ Practice book, Twelfth Edition","4.8 out of 5 stars"
"TALES FROM THE HIMALAYAS","4.7 out of 5 stars"
"Barron`s IELTS (With Audio CD)","4.1 out of 5 stars"
"A Competitive Book of Agriculture - 10/e - 2021","4.3 out of 5 stars"
"101 Word Search Activity Book","4.6 out of 5 stars"
"How To Draw Cute girls: The Step By Step Guide To Drawing 12 Cute Girls Easily (BOOK 2).",""
"Mojo In A Mango Tree","5.0 out of 5 stars"
"Objective Physics for JEE: Class XII","4.3 out of 5 stars"
"Who Will Cry When You Die?","4.5 out of 5 stars"
"Think and Grow Rich","4.5 out of 5 stars"
"The Courage To Be Disliked: How to free yourself, change your life and achieve real happiness (Courage To series)","4.5 out of 5 stars"
"Handbook of Obstetric and Gynecologic Emergencies 5/e","3.8 out of 5 stars"
"The Leadership Essentials - A Practical Handbook for Success","5.0 out of 5 stars"
"Clinical Implantology","4.5 out of 5 stars"
"Pendrive Classes CA Intermediate (New Syllabus) Gr. I Paper-1 Accounting (Complete Studymaterial + Video Lecture + Testseries) (May 2020)",""
"Genetics The Inheritance Biology Advanced Textbook for CSIR NET, GATE, DBT & ICMR Exam.","5.0 out of 5 stars"
"How to Win Friends and Influence People","4.5 out of 5 stars"
"My First 1000 Words: Early Learning Picture Book to Learn Alphabet, Numbers, Shapes and Colours, Transport, Birds and Animals, Professions, Opposite ... Parts of The Body and Objects Around Us.","4.5 out of 5 stars"
"A Complete Book of Puzzles & Seating Arrangement (Third Printed English Edition)","5.0 out of 5 stars"
"My First Little Librarian: Boxset of 12 Best Board Books for Kids","4.7 out of 5 stars"
"The Silent Patient: The record-breaking, multimillion copy Sunday Times bestselling thriller and Richard & Judy book club pick","4.5 out of 5 stars"
"Never Give Up - Overcome Life's Challenges and Achieve Success",""
"Moral Story Books for Kids (Pack of 10 Books) | 160 Total Pages | Illustrated Stories","4.4 out of 5 stars"
"ESL Instruction at Secondary Level",""
"Hunchprose","2.5 out of 5 stars"
"The Magic of the Lost Temple: Illustrated, easy to read and much-loved first full length children’s fiction novel by Sudha Murty for ages 8–12","4.7 out of 5 stars"
"Grandparents' Bag of Stories","4.8 out of 5 stars"
"Spoken English Course (Telugu)","4.5 out of 5 stars"
"NCERT Textbook Geography Books 6th to 12th (1 Combo Set) English Medium","4.3 out of 5 stars"
"1001 Activities Book","4.5 out of 5 stars"
"Lassie A Memoir: A poignant story of a pet","5.0 out of 5 stars"
"Muqaddar: Katha Aurangazebachi","4.7 out of 5 stars"
"Rasbhari Season - 1",""
"Learning with Python","4.0 out of 5 stars"
"Zayn & Zoey Habitat Series (Set of 5 books - Rainforest, Desert, Polar, Coral Reefs, Savannahs)","4.4 out of 5 stars"
"A simple guide for B.ARCH/B.PLAN and NATA Entrance Examination(Revised Edition-2021)with Additional Online Study Material through Mobile App+Online Mocktest Series(30+)+2 Ebooks +500 Solved Sketches)-COMBO 2021/2022","4.7 out of 5 stars"
"Handbook of Kidney Transplantation 6","4.5 out of 5 stars"
"Fundamentals of Essay and Answer Writing","4.8 out of 5 stars"
"Brilliant Brain Activity Book 4+","4.6 out of 5 stars"
"NCERT textbooks class 12th physics part 1&2 chemistry part 1&2 and biology combo 2020 editionpack of 5 books","2.5 out of 5 stars"
"Navneet Scholarship Examination Digest cum Practice Book - 2021 (Paper 1) - Standard V (Class 5) - English Medium - Maharashtra State Board","4.5 out of 5 stars"
"The Illustrated Stories Of Akbar and Birbal: Classic Tales From India","4.6 out of 5 stars"
"Learn to Read : The Dirty Worm - A Learn to Read Book for Kids 3-5: An early reader interactive book with a song for toddlers and older kids with an engaging ... hygiene (Learn to Read With Joe Worm 2)","4.8 out of 5 stars"
"Three Thousand Stitches: Ordinary People, Extraordinary Lives","4.6 out of 5 stars"
"The Entrepreneur","4.6 out of 5 stars"
"Krishnamurti's Notebook","4.8 out of 5 stars"
"The Complete Novels of Sherlock Holmes","4.5 out of 5 stars"
"Apke Avchetan Man Ki Shakti તમારું અર્ધજાગ્રત મનની શક્તિ (The Power of Your Subconscious Mind in Gujarati)","4.5 out of 5 stars"
"•|| रामराज्य ||• Ramrajya","4.7 out of 5 stars"
"Motivation - Adult Colouring Book for Peace & Relaxation","4.5 out of 5 stars"
"Picture Books Collection for Early Learning (Set of 12)","4.2 out of 5 stars"
"Here, There and Everywhere: Best-Loved Stories of Sudha Murty","4.7 out of 5 stars"
"EMRS-Eklavya Model Residential Schools -PGT Exam: Teaching Aptitude & Pedagogy Common For All Subjects (Teacher Recruitment Exams)",""
"To My Dear Brother: A Fill-in-the-Blank Gift for Brother | Birthday Gift for Brother | Raksha Bandhan Gift (english)",""
"Writing Practice Boxset: Pack of 4 Books (Writing Fun: Write and Practice Capital Letters, Small Letters, Patterns and Numbers 1 to 10)","4.4 out of 5 stars"
"Amazon Brand - Solimo Board Books for Kids (Set of 10)","4.5 out of 5 stars"
"The 10X Rule: The Only Difference Between Success and Failure","4.6 out of 5 stars"
"World’s Greatest Books For Personal Growth & Wealth (Set of 4 Books): Perfect Motivational Gift Set","4.5 out of 5 stars"
"Hero ki Kahani: Chaar Bhaiyon Ka Audhyogik Chamatkaar",""
"The Book Thief (Definitions Young Adult)","4.6 out of 5 stars"
"Educart All Subjects Final Revision Book Of CBSE Class 10 Strictly For May 2021 Exam (Objective Maps + Case based Q + Sample Paper)","4.4 out of 5 stars"
"Table Book: Tables 1 to 40: Tables 1 - 40","4.6 out of 5 stars"
"Here, There and Everywhere: Best-Loved Stories of Sudha Murty","4.7 out of 5 stars"
"101 Spot the Differences : Fun Activity Books For Children (With Answer sheets)","4.6 out of 5 stars"
"My Activity- ABC Writing Book","4.4 out of 5 stars"
"Refreshing Mandala - Colouring Book for Adults Book 1","4.6 out of 5 stars"
"Harry Potter and the Philosopher's Stone","4.7 out of 5 stars"
"Eternal Health: The Essence of Ayurveda","4.4 out of 5 stars"
"Amazon Brand - Solimo My First Activity Box (Set of 10)","3.6 out of 5 stars"
"Ruskin Bond - Best Selling Children Story Books Collection (Set of 4 Books)","4.5 out of 5 stars"
"Naveen Ankganit by RS Agarwal : math book for competitive exam 2021 (Hindi Edition)",""
"How to Prepare for Quantitative Aptitude for the CAT","4.5 out of 5 stars"
"Why I am an Atheist and Other Works","4.6 out of 5 stars"
"Factfulness: Ten Reasons We're Wrong About The World - And Why Things Are Better Than You Think","4.6 out of 5 stars"
"BlackBook of English Vocabulary February 2021 by Nikhil Gupta","4.5 out of 5 stars"
"Mission CHO Guide/Community Health Officer Book/Best book for all State's CHO Exams/Staff Nurse Book/Coloured/English/2nd Edition-2021","4.3 out of 5 stars"
"The Hobbit & The Lord of the Rings Boxed Set","4.6 out of 5 stars"
"The Upanishads (Deluxe Silk Hardbound)","4.4 out of 5 stars"
"This World Below Zero Fahrenheit: Travels in the Kashmir Valley","5.0 out of 5 stars"
"Node.js in Action","3.6 out of 5 stars"
"Myths And Legends From Around The World","4.5 out of 5 stars"
"Factfulness: Ten Reasons We're Wrong About The World - And Why Things Are Better Than You Think","4.6 out of 5 stars"
"The Hobbit & The Lord of the Rings Boxed Set","4.6 out of 5 stars"
"Mission CHO Guide/Community Health Officer Book/Best book for all State's CHO Exams/Staff Nurse Book/Coloured/English/2nd Edition-2021","4.3 out of 5 stars"
"The Official Cambridge Guide To Ielts Student's Book With Answers With Dvd Rom","4.3 out of 5 stars"
"Sudoku Puzzle Game Book Volume 2: 200+ Easy, Medium, and Hard Large Print Puzzle Book For Adults - Brain Teasing Puzzles","4.5 out of 5 stars"
"Amazon Brand - Solimo Board Books for Kids (Set of 10)","4.5 out of 5 stars"
"The Dangerous Book for Boys - Season 1",""
"Zindagi Benakaab","3.5 out of 5 stars"
"Coffee Table Book","5.0 out of 5 stars"
"The Power of Your Subconscious Mind (DELUXE HARDBOUND EDITION)","4.5 out of 5 stars"
"Spoken English Guru English Speaking Course Book and Daily Use English Sentences Book with English Grammar Charts.","4.1 out of 5 stars"
"Blue Line Pro Comic Book Layout 35 Count Pack",""
"And Then There Were None: The World’s Favourite Agatha Christie Book","4.6 out of 5 stars"
"How To Draw Cute Girls: The Step By Step Guide To Drawing 12 Cute Girls Easily (BOOK 3).",""
"Pratipaschandra","4.5 out of 5 stars"
"Agnipankh","4.7 out of 5 stars"
"Karma: A Yogi's Guide to Crafting Your Destiny Special Offer Alert! Limited Edition! Readers who Pre-order Karma will receive a copy with a special message from Sadhguru",""
"Mahatma Gandhi Autobiography: The Story Of My Experiments With Truth","4.5 out of 5 stars"
"The Right Place",""
"मैं अखबार हूं 1EK Newsway ( Novel )","5.0 out of 5 stars"
"Shafer's Textbook of Oral Pathology","4.6 out of 5 stars"
"MADHYKALIN SANT-SAHITIYA KA JANTANTRIK SUVRUP",""
"The Dangerous Book for Boys - Season 1",""
"Score More Case Study Chapterwise Practice Questions Science Mathematics English and Social Science Class 10","4.4 out of 5 stars"
"The Rudest Book Ever","4.4 out of 5 stars"
"Math Magic Textbook in Mathematics for Class - 2 - 219","4.4 out of 5 stars"
"World’s Greatest Books For Personal Growth & Wealth (Set of 4 Books)","4.6 out of 5 stars"
"Bibi Spider – An Early Reader Story Book for Toddlers, Preschoolers and Kids in Kindergarten: An Easy to Read Aloud Tale for Children ages 1 to 5","4.5 out of 5 stars"
"New Topo Map Book for Class IX & X - CISCE Board (revised Edition)","4.6 out of 5 stars"
"All set to Read-A Phonic Reader-Level 1- PHONICS READERS- 6 books in a Box: Box set","4.6 out of 5 stars"
"The Richest Man in Babylon","4.4 out of 5 stars"
"Essential Guide To Ethical Hacking","5.0 out of 5 stars"
"Bare Necessities: How to Live a Zero-Waste Life","4.7 out of 5 stars"
"The Secret by Rhonda Byrne Personal Transformation Book","4.6 out of 5 stars"
"The Jungle Book - Season 3",""
"200+ Puzzles-Useful for Banking & Government Exams like IBPS, SBI, RBI, LIC, NIACL, UIIC & others.","4.5 out of 5 stars"
"Rahasya (Hindi)","4.5 out of 5 stars"
"யாசிக்காதே போ. (Tamil Edition)",""
"Karma: A Yogi's Guide to Crafting Your Destiny Special Offer Alert! Limited Edition! Readers who Pre-order Karma will receive a copy with a special message from Sadhguru",""
"Mahatma Gandhi Autobiography: The Story Of My Experiments With Truth","4.5 out of 5 stars"
"Fundamentals of Business Analytics, 2ed","4.3 out of 5 stars"
"Amazon Brand - Solimo Picture Books Collection for Early Learning (Set of 12)",""
"Tally.ERP 9 with GST in Simple Steps","3.6 out of 5 stars"
"Read It Yourself 1-50 TBP","4.5 out of 5 stars"
"Rahasya (Hindi)","4.5 out of 5 stars"
"Think & Grow Rich","4.3 out of 5 stars"
"101 Brain Booster Activity Book: Fun Activity Book For Children","4.4 out of 5 stars"
"Ladies to be Enamored With: A Clean & Sweet Regency Historical Romance Book Collection",""
"Ancient and Medieval India(New edition)","4.6 out of 5 stars"
"My First Complete Learning Library: Boxset of 20 Board Books Gift Set for Kids (Horizontal Design)","4.6 out of 5 stars"
"Nursery Rhymes Board Book (My First Book Series): Illustrated Classic Nursery Rhymes","4.6 out of 5 stars"
"Believe in Yourself","4.3 out of 5 stars"
"The Rise of the Robots: FT and McKinsey Business Book of the Year","4.5 out of 5 stars"
"Nukkad Gungunate Hain","5.0 out of 5 stars"
"Attitude Is Everything: Change Your Attitude ... Change Your Life!","4.5 out of 5 stars"
"Little Artist Series Fruits: Copy Colour Books","4.5 out of 5 stars"
"NCERT Class 2 Book Set 3 Books (Rimjhim, Marigold, Maths Magic)","3.4 out of 5 stars"
"101 Maze Activity Book: Fun Activity Book For Children","4.2 out of 5 stars"
"The Power of Your Subconscious Mind","4.5 out of 5 stars"
"ALL NCERT HISTORY BOOKS FOR Class - 6 TO 12 (ENGLISH MEDIUM) IN COMBO PACK for UPSC Prelims / Main / IAS / Civil Services / IFS / IES / ISS / CISF / CDS / SCRA / IFS / NDA (9 BOOKS)","4.3 out of 5 stars"
"Target High - 5th Premium Colored International Edition","4.6 out of 5 stars"
"The Subtle Art of Not Giving a F*ck: A Counterintuitive Approach to Living a Good Life","4.5 out of 5 stars"
"Amazon Brand - Solimo Hindi Sulekh Pustak (A Set of 5 Books)","4.6 out of 5 stars"
"The Prophet","4.4 out of 5 stars"
"Zayn & Zoey CONTINENTS (Set of 6 books - Asia, Africa, North America, South America, Australia, Europe)","4.9 out of 5 stars"
"Tally.ERP 9 with GST in Simple Steps","3.6 out of 5 stars"
"Colouring Books Boxset: Pack of 12 Copy Colour Books for Children","4.5 out of 5 stars"
"Ladies to be Enamored With: A Clean & Sweet Regency Historical Romance Book Collection",""
"HAL Design Trainee Preparation Book 2021",""
"World's Greatest Entrepreneurs: Biographies of Inspirational Personalities For Kids","4.4 out of 5 stars"
"Cutout Board Book: Festivals of India (Cutout Books)","4.4 out of 5 stars"
"JOLLY PHONICS PUPIL BOOK 2 (JL8684)","5.0 out of 5 stars"
"101 Tales The Great Panchatantra Collection - Collection Of Witty Moral Stories For Kids For Personality Development","4.3 out of 5 stars"
"Believe in Yourself","4.3 out of 5 stars"
"Bitter Sweet Love (Volume 2) (Michael Faudet)","4.8 out of 5 stars"
"Scanner CMA Foundation (2016 Syllabus) Paper-1 Fundamentals of Economics and Management (Regular Edition) (Applicable for June 2020 Attempt)",""
"Encyclopedia of Space ( Set of 8 Books) (Encyclopedias)","4.5 out of 5 stars"
"Range: How Generalists Triumph in a Specialized World","4.5 out of 5 stars"
"Doodle Coloring For Girls (Doodle Coloring Books)","4.5 out of 5 stars"
"Colouring Books Collections by InIkao (12 Books) : Pack of 12 Copy Color Books For Kids","4.5 out of 5 stars"
"The Power of Your Subconscious Mind","4.5 out of 5 stars"
"Just Add Magic - Season 101",""
"Target High - 5th Premium Colored International Edition","4.6 out of 5 stars"
"Brilliant Brain Activity Book 3+","4.6 out of 5 stars"
"Vrindavan shopi Shri Kritivasi Ramayan Bangla By Benimadhav Seel + Wooden Book Stand From Vrindavan (HArd, Bangla, Benimadhab=v seel)","5.0 out of 5 stars"
"Human Body - Brain And Nervous System: Knowledge Encyclopedia For Children","4.3 out of 5 stars"
"Pratiksha","5.0 out of 5 stars"
"Guided Physics Practical Word - Book (I.S.C - XII)","5.0 out of 5 stars"
"Oil & Acrylic: Pet Portraits (How to Draw & Paint)","4.2 out of 5 stars"
"Your Best Day Is Today!","4.3 out of 5 stars"
"Zen: The Art of Simple Living","4.6 out of 5 stars"
"Sudha Murty 3 books combo ( Marathi ) - Teen Hajar Take+ Ayushyache Dhade Girvtana+Wise and Otherwise","4.7 out of 5 stars"
"Lakshya SI (Sub Inspector) Bhag FIRST with updated syllabus by Mahaveer jain kanthi jain",""
"My First Super Boxset of Pencil Control and Patterns : Pack of 4 interactive activity books to practice Patterns, Numbers and Alphabet: A set of 4 ... to practice Patterns, Numbers and Alphabet","4.5 out of 5 stars"
"Educart CBSE Class 12 Chemistry Sample Question Papers Book 2021 (By Arvind Arora, A2 Sir)","4.6 out of 5 stars"
"Don't Lose Your Mind, Lose Your Weight","4.4 out of 5 stars"
"Life Anecdotes","5.0 out of 5 stars"
"My Gratitude Book : A personal guide to start giving thanks and learn to practice gratitude, includes all the aspects of life, a great book for beginners and young learners. Gratitude Journal",""
"The Book of Ichigo Ichie: The Art of Making the Most of Every Moment, the Japanese Way","4.6 out of 5 stars"
"आवेज़ा (Hindi Edition)","5.0 out of 5 stars"
"Rich Dad Poor Dad - 20th Anniversary Edition (Hindi)","4.6 out of 5 stars"
"Kids Story Book in Telugu - 50 Stories ( 5 Books ) | Children's Bedtime Grandma Panchatantra Moral Short Stories Books | Classic Illustrated tales | (Age 3 to 6 Year Old)","4.2 out of 5 stars"
"Encyclopedia: Space (Space Encyclopedia)","4.4 out of 5 stars"
"PTET RAJASTHAN PRE. B.Ed. TEST","1.0 out of 5 stars"
"Master Reasoning Book Verbal, Non-Verbal & Analytical","4.3 out of 5 stars"
"Master Guide SSC CGL Combined Graduate Level Tier-I 2021","4.0 out of 5 stars"
"Who are You?",""
"Amazon Brand - Solimo Pop-Up Board Book Set (10 Titles)","4.5 out of 5 stars"
"BENARES ILLUSTRATED",""
"ACE LKG Kids All-in-One Worksheets 304 pages (KG 1) & Montessori (3-5 yrs) (English, Hindi, Mathematics, General Knowledge / EVS & Fun Colouring Activity Workbook Combo) from 3H Learning","4.3 out of 5 stars"
"Aaha Kalyanam (Telugu Dubbed)",""
"PTET RAJASTHAN PRE. B.Ed. TEST","1.0 out of 5 stars"
"The Prophet","4.6 out of 5 stars"
"Master Guide SSC CGL Combined Graduate Level Tier-I 2021","4.0 out of 5 stars"
"Encyclopedia: Space (Space Encyclopedia)","4.4 out of 5 stars"
"Master Reasoning Book Verbal, Non-Verbal & Analytical","4.3 out of 5 stars"
"NCERT Class 5 Book Set 4 Books (Marigold, Rimjhim, Maths Magic and Looking Around) SchoolWaale Binded","3.0 out of 5 stars"
"My Activity- ABC Colouring Book","4.4 out of 5 stars"
"Essentials of Critical Care Practical Examinations","4.0 out of 5 stars"
"Scanner CMA Foundation (2016 Syllabus) Paper-2 Fundamentals of Accounting (Regular Edition) (Applicable for June 2020 Attempt)",""
"6666 English MCQs Book","4.7 out of 5 stars"
"Harry Potter and the Chamber of Secrets (Harry Potter 2)","4.7 out of 5 stars"
"JOLLY PHONICS PUPIL BOOK 1 (JL8677)","5.0 out of 5 stars"
"365 Colouring Book","4.6 out of 5 stars"
"UPSC EPFO (Enforcement Officers/Accounts Officers) Exam 2020 Guide","4.0 out of 5 stars"
"My First All in One: Bilingual Picture Book for Kids Hindi-English","4.4 out of 5 stars"
"The Graveyard Book","4.6 out of 5 stars"
"The Book Of Disquiet (Penguin Modern Classics)","4.6 out of 5 stars"
"View from the Top (2003) Gwyneth Paltrow, Christina Applegate","4.6 out of 5 stars"
"English Worksheet for Class 1",""
"schizophrenia - स्किझोफ्रेनिया (वास्तव आणि सजगतेसह जीवनप्रवास )","5.0 out of 5 stars"
"Great fairy Tales Forever Classics ( Set of 8 Fairy tales with colourful pictures)- Story Book for kids-The Ugly Duckling, Cinderella, Goldilocks and the Three Bears, The Frog Prince, The princess and the pea, The Little Match Girl , Snow white and Rose red, Ali Baba and the Forty Theives","4.0 out of 5 stars"
"Ravan - Raja Rakshasancha + The Entrepreneur (Set of 2 Books) (Marathi)","4.1 out of 5 stars"
"The Prophet","4.6 out of 5 stars"
"GSSSB Sub Accountant Sub Auditor Class 3 Exam Book (Gujarati Edition)","1.0 out of 5 stars"
"Brain Games for Clever Kids: Puzzles to Exercise Your Mind (Buster Brain Games, 1)","4.3 out of 5 stars"
"Harry Potter and the Order of the Phoenix (Harry Potter 5)","4.7 out of 5 stars"
"Lines and Curves (Pattern Writing) - Part 1","4.4 out of 5 stars"
"Great Stories for Children","4.5 out of 5 stars"
"PTET RAJASTHAN PRE. B.Ed. TEST","1.0 out of 5 stars"
"The Biology of Belief : Unleashing the Power of Consciousness, Matter and Miracles","3.4 out of 5 stars"
"Amazon Brand - Solimo My Very First Foam Books (Set of 3, Alphabets, Know your Body, Animals & Birds)","3.9 out of 5 stars"
"Animals Tales From Panchtantra: Timeless Stories for Children From Ancient India","4.6 out of 5 stars"
"Writing 123 (1-20) (Pre-School Picture Books)","4.3 out of 5 stars"
"NCERT Textbooks in English for class 12 - Flamingo and Vistas - 12074 &12075","4.5 out of 5 stars"
